{
  "day": "2026-07-30",
  "verdict": "match",
  "live_r": -1.7325,
  "backtest_r": -1.7325,
  "causes": [],
  "notes": [
    "Synthetic parity, not a forward track record."
  ],
  "live_trades": [
    {
      "id": 1,
      "date": "2026-07-30",
      "setup": "orx",
      "side": "long",
      "grade": "A",
      "regime": "trend",
      "opened": "2026-07-30T13:30:00.000Z",
      "closed": "2026-07-30T13:55:00.000Z",
      "entry": 20006.5,
      "stop": 19998.5,
      "t1": 20010.5,
      "final": 20022.5,
      "risk_pts": 8,
      "exit": 19998.5,
      "exit_reason": "stop",
      "t1_hit": false,
      "r": -1.0775,
      "pts": -8,
      "usd": -17.24,
      "mfe_pts": 0.5,
      "mae_pts": 8.5,
      "score": 70,
      "reasons": [
        "Synthetic signal for fixture testing; no trading rule was evaluated."
      ],
      "sample": "in"
    },
    {
      "id": 2,
      "date": "2026-07-30",
      "setup": "orx",
      "side": "short",
      "grade": "A",
      "regime": "trend",
      "opened": "2026-07-30T14:30:00.000Z",
      "closed": "2026-07-30T14:55:00.000Z",
      "entry": 20007.75,
      "stop": 20015.75,
      "t1": 20003.75,
      "final": 19991.75,
      "risk_pts": 8,
      "exit": 20015.75,
      "exit_reason": "stop",
      "t1_hit": false,
      "r": -1.0775,
      "pts": -8,
      "usd": -17.24,
      "mfe_pts": 0.5,
      "mae_pts": 8.5,
      "score": 80,
      "reasons": [
        "Synthetic signal for fixture testing; no trading rule was evaluated."
      ],
      "sample": "in"
    },
    {
      "id": 3,
      "date": "2026-07-30",
      "setup": "orx",
      "side": "long",
      "grade": "B",
      "regime": "trend",
      "opened": "2026-07-30T15:30:00.000Z",
      "closed": "2026-07-30T15:55:00.000Z",
      "entry": 20004,
      "stop": 19996,
      "t1": 20008,
      "final": 20020,
      "risk_pts": 8,
      "exit": 20008,
      "exit_reason": "target",
      "t1_hit": true,
      "r": 0.4225,
      "pts": 4,
      "usd": 6.76,
      "mfe_pts": 4.5,
      "mae_pts": 0.5,
      "score": 90,
      "reasons": [
        "Synthetic signal for fixture testing; no trading rule was evaluated."
      ],
      "sample": "in"
    }
  ],
  "backtest_trades": [
    {
      "id": 1,
      "date": "2026-07-30",
      "setup": "orx",
      "side": "long",
      "grade": "A",
      "regime": "trend",
      "opened": "2026-07-30T13:30:00.000Z",
      "closed": "2026-07-30T13:55:00.000Z",
      "entry": 20006.5,
      "stop": 19998.5,
      "t1": 20010.5,
      "final": 20022.5,
      "risk_pts": 8,
      "exit": 19998.5,
      "exit_reason": "stop",
      "t1_hit": false,
      "r": -1.0775,
      "pts": -8,
      "usd": -17.24,
      "mfe_pts": 0.5,
      "mae_pts": 8.5,
      "score": 70,
      "reasons": [
        "Synthetic signal for fixture testing; no trading rule was evaluated."
      ],
      "sample": "in"
    },
    {
      "id": 2,
      "date": "2026-07-30",
      "setup": "orx",
      "side": "short",
      "grade": "A",
      "regime": "trend",
      "opened": "2026-07-30T14:30:00.000Z",
      "closed": "2026-07-30T14:55:00.000Z",
      "entry": 20007.75,
      "stop": 20015.75,
      "t1": 20003.75,
      "final": 19991.75,
      "risk_pts": 8,
      "exit": 20015.75,
      "exit_reason": "stop",
      "t1_hit": false,
      "r": -1.0775,
      "pts": -8,
      "usd": -17.24,
      "mfe_pts": 0.5,
      "mae_pts": 8.5,
      "score": 80,
      "reasons": [
        "Synthetic signal for fixture testing; no trading rule was evaluated."
      ],
      "sample": "in"
    },
    {
      "id": 3,
      "date": "2026-07-30",
      "setup": "orx",
      "side": "long",
      "grade": "B",
      "regime": "trend",
      "opened": "2026-07-30T15:30:00.000Z",
      "closed": "2026-07-30T15:55:00.000Z",
      "entry": 20004,
      "stop": 19996,
      "t1": 20008,
      "final": 20020,
      "risk_pts": 8,
      "exit": 20008,
      "exit_reason": "target",
      "t1_hit": true,
      "r": 0.4225,
      "pts": 4,
      "usd": 6.76,
      "mfe_pts": 4.5,
      "mae_pts": 0.5,
      "score": 90,
      "reasons": [
        "Synthetic signal for fixture testing; no trading rule was evaluated."
      ],
      "sample": "in"
    }
  ],
  "uptime_gaps": []
}
